{
  "schema_version": "1.0",
  "license": "OFL-1.1",
  "role_candidates": {
    "formal_serif": ["noto-serif-sc"],
    "modern_sans": ["noto-sans-sc"],
    "ceremonial_display": ["cinzel", "noto-serif-sc"],
    "children_round": ["baloo-2", "noto-sans-sc"]
  },
  "fonts": [
    {
      "id": "noto-serif-sc",
      "family": "Noto Serif SC",
      "version": "2.003-H1",
      "file": "noto-serif-sc/NotoSerifSC[wght].ttf",
      "sha256": "050080d9255a86808f2945bffac582b31ef32bc36411ce29563b4961670c66f9",
      "license_file": "noto-serif-sc/OFL.txt",
      "metadata_file": "noto-serif-sc/METADATA.pb",
      "source_url": "https://github.com/google/fonts/tree/main/ofl/notoserifsc",
      "scripts": ["latin", "simplified_chinese"]
    },
    {
      "id": "noto-sans-sc",
      "family": "Noto Sans SC",
      "version": "2.004-H2",
      "file": "noto-sans-sc/NotoSansSC[wght].ttf",
      "sha256": "a3041811a78c361b1de50f953c805e0244951c21c5bd412f7232ef0d899af0da",
      "license_file": "noto-sans-sc/OFL.txt",
      "metadata_file": "noto-sans-sc/METADATA.pb",
      "source_url": "https://github.com/google/fonts/tree/main/ofl/notosanssc",
      "scripts": ["latin", "simplified_chinese"]
    },
    {
      "id": "cinzel",
      "family": "Cinzel",
      "version": "2.000",
      "file": "cinzel/Cinzel[wght].ttf",
      "sha256": "f4d83d34d1f6c741193e4acf4b3dff9531e5a67b6aa65228d00a7db72a4e0f34",
      "license_file": "cinzel/OFL.txt",
      "metadata_file": "cinzel/METADATA.pb",
      "source_url": "https://github.com/google/fonts/tree/main/ofl/cinzel",
      "scripts": ["latin"]
    },
    {
      "id": "baloo-2",
      "family": "Baloo 2",
      "version": "1.700",
      "file": "baloo-2/Baloo2[wght].ttf",
      "sha256": "d47a6852548059b1db49a1319d06d499d546c3fa2237cf9eee9c43c8abb025c2",
      "license_file": "baloo-2/OFL.txt",
      "metadata_file": "baloo-2/METADATA.pb",
      "source_url": "https://github.com/google/fonts/tree/main/ofl/baloo2",
      "scripts": ["latin"]
    }
  ]
}
